{
  "digest": {
    "value": "29e597dd82fb7a3316ce99ccc61596abfeae6b4bec959034b21a6e3aa9706794",
    "algorithm": "sha256",
    "digestDomain": "io.hacp.task-packet.v0.3-candidate",
    "canonicalization": "json-rfc8785-jcs"
  },
  "packetId": "taskpkt_wits_01a07ef6_ca37_71eb_baef_9a23af371b20",
  "loopPolicy": {
    "mode": "single_pass",
    "ceiling": 0,
    "counter": 0,
    "incrementTrigger": "post_return_human_approval_of_another_packet",
    "boundaryStatement": "One bounded successor only; a later continuation requires another human decision.",
    "claimAttemptLimit": 1,
    "automaticRetryAllowed": false
  },
  "recordKind": "hacp.v0_3_candidate.task_packet",
  "profileRefs": [
    "hacp-accountable-continuation-v0.3-candidate"
  ],
  "schemaVersion": "hacp-0.3-candidate",
  "sourceContext": {
    "sourceRefs": [
      "wits://case/d953db75-f022-447a-9c28-a2022daada34/product-decisions/01a07ef6-ca2b-7b6b-9e95-a07c4ffd3834",
      "wits://product-decision-action/01a07ef6-ca37-71eb-baef-9a23af371b20"
    ],
    "humanRequest": "May one public-safe conformance successor begin?"
  },
  "requestedScope": [
    "produce a public-safe stopped bundle"
  ],
  "stopConditions": [
    "missing human decision",
    "scope mismatch",
    "stale or revoked decision",
    "unsupported continuation extension"
  ],
  "expectedEvidence": [
    "human decision",
    "consumption receipt",
    "agent report or stop response"
  ],
  "forbiddenEffects": [
    "merge",
    "deploy",
    "provider_or_model_invocation",
    "external_mutation",
    "accept_risk"
  ],
  "boundaryStatement": "This packet is a non-authorizing projection of requested work. It does not launch or approve a successor."
}
